84,pub.1127520414,10.1016/j.athoracsur.2020.05.002,32407853,PMC7215160,Ramping up Delivery of Cardiac Surgery During the COVID-19 Pandemic: A Guidance Statement from The Society of Thoracic Surgeons COVID-19 Task Force,The Annals of Thoracic Surgery,,,2020-05,2020,,,,All OA; Gold,Article,"Engelman, Daniel T.; Lother, Sylvain; George, Isaac; Ailawadi, Gorav; Atluri, Pavan; Grant, Michael C.; Haft, Jonathan W.; Hassan, Ansar; Legare, Jean-Francois; Whitman, Glenn; Arora, Rakesh C.; Surgery, Society of Thoracic Surgeons COVID-19 Task Force and Workforce for Adult Cardiac and Vascular","Engelman, Daniel T. (Baystate Health)","Engelman, Daniel T. (Baystate Health); Lother, Sylvain (University of Manitoba); George, Isaac (NewYork–Presbyterian Hospital); Ailawadi, Gorav (University of Virginia); Atluri, Pavan (University of Pennsylvania); Grant, Michael C. (Johns Hopkins University); Haft, Jonathan W. (University of Michigan); Hassan, Ansar (Horizon Health Network); Legare, Jean-Francois (Horizon Health Network); Whitman, Glenn (Johns Hopkins University); Arora, Rakesh C. (University of Manitoba; St. Boniface General Hospital); Surgery, Society of Thoracic Surgeons COVID-19 Task Force and Workforce for Adult Cardiac and Vascular (Baystate Health; University of Manitoba; NewYork–Presbyterian Hospital; University of Virginia; University of Pennsylvania; Johns Hopkins University; University of Michigan; Horizon Health Network; Johns Hopkins University; University of Manitoba; St. Boniface General Hospital)",University of Manitoba; Baystate Health; University of Michigan; Johns Hopkins University; St. Boniface General Hospital; Horizon Health Network; University of Pennsylvania; NewYork–Presbyterian Hospital; University of Virginia,grid.21613.37; grid.476946.e; grid.214458.e; grid.21107.35; grid.416356.3; grid.428748.5; grid.25879.31; grid.413734.6; grid.27755.32,Canada; United States; United States; United States; Canada; Canada; United States; United States; United States,,1,1,,,5,https://doi.org/10.1016/j.athoracsur.2020.05.002,https://app.dimensions.ai/details/publication/pub.1127520414,1117 Public Health and Health Services; 11 Medical and Health Sciences,
58,pub.1126271841,10.1002/phar.2394,32267979,PMC7262068,COVID‐19: The Uninvited Guest in the Intensive Care Unit — Implications for Pharmacotherapy,Pharmacotherapy The Journal of Human Pharmacology and Drug Therapy,,"Antiviral Agents; Betacoronavirus; Clinical Trials as Topic; Coronavirus Infections; Glucocorticoids; Humans; Immunomodulation; Intensive Care Units; Pandemics; Pneumonia, Viral",2020-05,2020,40,5,382-386,All OA; Gold,Article,"Stringer, Kathleen A.; Puskarich, Michael A.; Kenes, Michael T.; Dickson, Robert P.",,"Stringer, Kathleen A. (University of Michigan; University of Michigan; University of Michigan); Puskarich, Michael A. (University of Minnesota; Hennepin County Medical Center); Kenes, Michael T. (University of Michigan); Dickson, Robert P. (University of Michigan; University of Michigan)",University of Michigan; Hennepin County Medical Center; University of Minnesota,grid.214458.e; grid.414021.2; grid.17635.36,United States; United States; United States,,3,3,,,15,https://accpjournals.onlinelibrary.wiley.com/doi/pdfdirect/10.1002/phar.2394,https://app.dimensions.ai/details/publication/pub.1126271841,11 Medical and Health Sciences; 1115 Pharmacology and Pharmaceutical Sciences,
57,pub.1125679184,10.1016/j.ijid.2020.03.019,32171951,PMC7194910,Preliminary estimation of the novel coronavirus disease (COVID-19) cases in Iran: A modelling analysis based on overseas cases and air travel data,International Journal of Infectious Diseases,,"Air Travel; Betacoronavirus; Coronavirus Infections; Humans; Iran; Pandemics; Pneumonia, Viral; Travel-Related Illness",2020-05,2020,94,,29-31,All OA; Gold,Article,"Zhuang, Zian; Zhao, Shi; Lin, Qianying; Cao, Peihua; Lou, Yijun; Yang, Lin; He, Daihai","Yang, Lin (Hong Kong Polytechnic University)","Zhuang, Zian (Hong Kong Polytechnic University); Zhao, Shi (Chinese University of Hong Kong; Chinese University of Hong Kong); Lin, Qianying (University of Michigan); Cao, Peihua (Southern Medical University); Lou, Yijun (Hong Kong Polytechnic University); Yang, Lin (Hong Kong Polytechnic University); He, Daihai (Hong Kong Polytechnic University)",Hong Kong Polytechnic University; University of Michigan; Southern Medical University; Chinese University of Hong Kong,grid.16890.36; grid.214458.e; grid.284723.8; grid.10784.3a,China; United States; China; China,,12,12,,,1,https://doi.org/10.1016/j.ijid.2020.03.019,https://app.dimensions.ai/details/publication/pub.1125679184,1117 Public Health and Health Services; 11 Medical and Health Sciences,
51,pub.1126666956,10.1111/jgs.16490,32293023,PMC7262293,ResearchCOVID‐19 Preparedness in Michigan Nursing Homes,Journal of the American Geriatrics Society,,,2020-05,2020,68,5,937-939,All OA; Gold,Article,"Jones, Karen M.; Mantey, Julia; Mills, John P.; Montoya, Ana; Min, Lillian; Gibson, Kristen; Mody, Lona",,"Jones, Karen M. (University of Michigan); Mantey, Julia (University of Michigan); Mills, John P. (University of Michigan); Montoya, Ana (University of Michigan); Min, Lillian (University of Michigan; University of Michigan); Gibson, Kristen (University of Michigan); Mody, Lona (University of Michigan)",University of Michigan,grid.214458.e,United States,National Institute on Aging; Agency for Healthcare Research and Quality,3,3,,,97,https://onlinelibrary.wiley.com/doi/pdfdirect/10.1111/jgs.16490,https://app.dimensions.ai/details/publication/pub.1126666956,11 Medical and Health Sciences,
48,pub.1127766195,10.1002/cld.969,32537133,PMC7280641,Potential Treatments for SARS‐CoV‐2 Infection,Clinical Liver Disease,,,2020-05,2020,15,5,181-186,All OA; Gold,Article,"Berry, Sameer K.; Fontana, Robert J.",,"Berry, Sameer K. (University of Michigan); Fontana, Robert J. (University of Michigan)",University of Michigan,grid.214458.e,United States,,0,0,,,5,https://aasldpubs.onlinelibrary.wiley.com/doi/pdfdirect/10.1002/cld.969,https://app.dimensions.ai/details/publication/pub.1127766195,,
42,pub.1126776157,10.1016/j.ijid.2020.04.034,32315808,PMC7166025,The relative transmissibility of asymptomatic cases among close contacts,International Journal of Infectious Diseases,,"Asymptomatic Infections; Betacoronavirus; China; Coronavirus Infections; Humans; Pandemics; Pneumonia, Viral",2020-05,2020,94,,145-147,All OA; Gold,Article,"He, Daihai; Zhao, Shi; Lin, Qianying; Zhuang, Zian; Cao, Peihua; Wang, Maggie H; Yang, Lin","He, Daihai (Hong Kong Polytechnic University)","He, Daihai (Hong Kong Polytechnic University); Zhao, Shi (Chinese University of Hong Kong; Chinese University of Hong Kong); Lin, Qianying (University of Michigan); Zhuang, Zian (Hong Kong Polytechnic University); Cao, Peihua (Southern Medical University); Wang, Maggie H (Chinese University of Hong Kong; Chinese University of Hong Kong); Yang, Lin (Hong Kong Polytechnic University)",University of Michigan; Chinese University of Hong Kong; Southern Medical University; Hong Kong Polytechnic University,grid.214458.e; grid.10784.3a; grid.284723.8; grid.16890.36,United States; China; China; China,,13,13,,,41,https://doi.org/10.1016/j.ijid.2020.04.034,https://app.dimensions.ai/details/publication/pub.1126776157,1117 Public Health and Health Services; 11 Medical and Health Sciences,
37,pub.1126184017,10.1016/j.radonc.2020.04.001,32342863,PMC7252074,Practice recommendations for lung cancer radiotherapy during the COVID-19 pandemic: An ESTRO-ASTRO consensus statement,Radiotherapy and Oncology,,"Betacoronavirus; Consensus; Coronavirus Infections; Delphi Technique; Europe; Humans; Lung Neoplasms; Pandemics; Pneumonia, Viral; Radiation Oncology; Societies, Medical; United States",2020-05,2020,146,,223-229,All OA; Gold,Article,"Guckenberger, Matthias; Belka, Claus; Bezjak, Andrea; Bradley, Jeffrey; Daly, Megan E.; DeRuysscher, Dirk; Dziadziuszko, Rafal; Faivre-Finn, Corinne; Flentje, Michael; Gore, Elizabeth; Higgins, Kristin A.; Iyengar, Puneeth; Kavanagh, Brian D; Kumar, Sameera; Le Pechoux, Cecile; Lievens, Yolande; Lindberg, Karin; McDonald, Fiona; Ramella, Sara; Rengan, Ramesh; Ricardi, Umberto; Rimner, Andreas; Rodrigues, George B.; Schild, Steven E.; Senan, Suresh; Simone, Charles B.; Slotman, Ben J.; Stuschke, Martin; Videtic, Greg; Widder, Joachim; Yom, Sue S.; Palma, David","Guckenberger, Matthias ","Guckenberger, Matthias (); Belka, Claus (Ludwig Maximilian University of Munich); Bezjak, Andrea (University of Toronto); Bradley, Jeffrey (Emory University); Daly, Megan E. (University of Michigan); DeRuysscher, Dirk (Maastricht University Medical Centre); Dziadziuszko, Rafal (Medical University of Gdansk); Faivre-Finn, Corinne (Christie Hospital NHS Foundation Trust); Flentje, Michael (University Hospital Würzburg); Gore, Elizabeth (University of Michigan); Higgins, Kristin A. (Emory University); Iyengar, Puneeth (The University of Texas Southwestern Medical Center); Kavanagh, Brian D (University of Colorado Anschutz Medical Campus); Kumar, Sameera (Temple University Health System); Le Pechoux, Cecile (Institut Gustave Roussy); Lievens, Yolande (Ghent University); Lindberg, Karin (Karolinska University Hospital); McDonald, Fiona (Royal Marsden Hospital); Ramella, Sara (Campus Bio-Medico University); Rengan, Ramesh (University of Washington); Ricardi, Umberto (University of Turin); Rimner, Andreas (Memorial Sloan Kettering Cancer Center); Rodrigues, George B. (Western University); Schild, Steven E. (Mayo Clinic); Senan, Suresh (); Simone, Charles B. (Memorial Sloan Kettering Cancer Center); Slotman, Ben J. (); Stuschke, Martin (University of Duisburg-Essen); Videtic, Greg (Case Western Reserve University); Widder, Joachim (Medical University of Vienna); Yom, Sue S. (University of California, San Francisco); Palma, David (Western University)","University of Duisburg-Essen; University of Turin; University of Toronto; Ghent University; Medical University of Vienna; University of Washington; Christie Hospital NHS Foundation Trust; Mayo Clinic; Western University; Medical University of Gdansk; Maastricht University Medical Centre; University of Colorado Anschutz Medical Campus; The University of Texas Southwestern Medical Center; Emory University; Royal Marsden Hospital; Campus Bio-Medico University; University of California, San Francisco; University Hospital Würzburg; Karolinska University Hospital; University of Michigan; Memorial Sloan Kettering Cancer Center; Temple University Health System; Ludwig Maximilian University of Munich; Institut Gustave Roussy; Case Western Reserve University",grid.5718.b; grid.7605.4; grid.17063.33; grid.5342.0; grid.22937.3d; grid.34477.33; grid.412917.8; grid.417468.8; grid.39381.30; grid.11451.30; grid.412966.e; grid.430503.1; grid.267313.2; grid.189967.8; grid.424926.f; grid.9657.d; grid.266102.1; grid.411760.5; grid.24381.3c; grid.214458.e; grid.51462.34; grid.412530.1; grid.5252.0; grid.14925.3b; grid.67105.35,Germany; Italy; Canada; Belgium; Austria; United States; United Kingdom; United States; Canada; Poland; Netherlands; United States; United States; United States; United Kingdom; Italy; United States; Germany; Sweden; United States; United States; United States; Germany; France; United States,,30,30,,,169,https://doi.org/10.1016/j.radonc.2020.04.001,https://app.dimensions.ai/details/publication/pub.1126184017,11 Medical and Health Sciences; 1112 Oncology and Carcinogenesis,
27,pub.1127241292,10.1038/s41562-020-0884-z,32355299,,Using social and behavioural science to support COVID-19 pandemic response,Nature Human Behaviour,,"Adaptation, Psychological; Betacoronavirus; Communicable Disease Control; Coronavirus; Coronavirus Infections; Decision Making; Epidemiological Monitoring; Global Health; Health Knowledge, Attitudes, Practice; Human Activities; Humans; Leadership; Pandemics; Pneumonia, Viral; Public Health; Quarantine; Social Media; Stress, Psychological",2020-05,2020,4,5,460-471,All OA; Gold,Article,"Bavel, Jay J. Van; Baicker, Katherine; Boggio, Paulo S.; Capraro, Valerio; Cichocka, Aleksandra; Cikara, Mina; Crockett, Molly J.; Crum, Alia J.; Douglas, Karen M.; Druckman, James N.; Drury, John; Dube, Oeindrila; Ellemers, Naomi; Finkel, Eli J.; Fowler, James H.; Gelfand, Michele; Han, Shihui; Haslam, S. Alexander; Jetten, Jolanda; Kitayama, Shinobu; Mobbs, Dean; Napper, Lucy E.; Packer, Dominic J.; Pennycook, Gordon; Peters, Ellen; Petty, Richard E.; Rand, David G.; Reicher, Stephen D.; Schnall, Simone; Shariff, Azim; Skitka, Linda J.; Smith, Sandra Susan; Sunstein, Cass R.; Tabri, Nassim; Tucker, Joshua A.; Linden, Sander van der; Lange, Paul van; Weeden, Kim A.; Wohl, Michael J. A.; Zaki, Jamil; Zion, Sean R.; Willer, Robb","Bavel, Jay J. Van (New York University)","Bavel, Jay J. Van (New York University); Baicker, Katherine (); Boggio, Paulo S. (Mackenzie Presbyterian University); Capraro, Valerio (Middlesex University); Cichocka, Aleksandra (University of Kent; Nicolaus Copernicus University); Cikara, Mina (Harvard University); Crockett, Molly J. (Yale University); Crum, Alia J. (Stanford University); Douglas, Karen M. (University of Kent); Druckman, James N. (Northwestern University); Drury, John (University of Sussex); Dube, Oeindrila (); Ellemers, Naomi (Utrecht University); Finkel, Eli J. (Northwestern University); Fowler, James H. (University of California, San Diego); Gelfand, Michele (University of Maryland, College Park); Han, Shihui (Peking University); Haslam, S. Alexander (University of Queensland); Jetten, Jolanda (University of Queensland); Kitayama, Shinobu (University of Michigan); Mobbs, Dean (California Institute of Technology); Napper, Lucy E. (Lehigh University); Packer, Dominic J. (Lehigh University); Pennycook, Gordon (University of Regina); Peters, Ellen (University of Oregon); Petty, Richard E. (The Ohio State University); Rand, David G. (Massachusetts Institute of Technology); Reicher, Stephen D. (University of St Andrews); Schnall, Simone (University of Cambridge; University of Cambridge); Shariff, Azim (University of British Columbia); Skitka, Linda J. (University of Illinois at Chicago); Smith, Sandra Susan (University of California, Berkeley); Sunstein, Cass R. (Harvard University); Tabri, Nassim (Carleton University); Tucker, Joshua A. (New York University); Linden, Sander van der (University of Cambridge); Lange, Paul van (VU Amsterdam); Weeden, Kim A. (Cornell University); Wohl, Michael J. A. (Carleton University); Zaki, Jamil (Stanford University); Zion, Sean R. (Stanford University); Willer, Robb (Stanford University)","Lehigh University; University of California, San Diego; New York University; University of Sussex; University of Regina; University of Kent; Utrecht University; Nicolaus Copernicus University; University of Maryland, College Park; University of Queensland; The Ohio State University; Carleton University; University of British Columbia; University of Cambridge; Harvard University; California Institute of Technology; Northwestern University; Yale University; University of St Andrews; Cornell University; VU Amsterdam; Middlesex University; Mackenzie Presbyterian University; Stanford University; University of Illinois at Chicago; University of Michigan; University of Oregon; University of California, Berkeley; Peking University; Massachusetts Institute of Technology",grid.259029.5; grid.266100.3; grid.137628.9; grid.12082.39; grid.57926.3f; grid.9759.2; grid.5477.1; grid.5374.5; grid.164295.d; grid.1003.2; grid.261331.4; grid.34428.39; grid.17091.3e; grid.5335.0; grid.38142.3c; grid.20861.3d; grid.16753.36; grid.47100.32; grid.11914.3c; grid.5386.8; grid.12380.38; grid.15822.3c; grid.412403.0; grid.168010.e; grid.185648.6; grid.214458.e; grid.170202.6; grid.47840.3f; grid.11135.37; grid.116068.8,United States; United States; United States; United Kingdom; Canada; United Kingdom; Netherlands; Poland; United States; Australia; United States; Canada; Canada; United Kingdom; United States; United States; United States; United States; United Kingdom; United States; Netherlands; United Kingdom; Brazil; United States; United States; United States; United States; United States; China; United States,"Coordenação de Aperfeicoamento de Pessoal de Nível Superior; National Council for Scientific and Technological Development; Directorate for Social, Behavioral & Economic Sciences",53,53,,,1080,https://www.nature.com/articles/s41562-020-0884-z.pdf,https://app.dimensions.ai/details/publication/pub.1127241292,17 Psychology and Cognitive Sciences; 1701 Psychology,
25,pub.1126388658,10.1038/s41562-020-0872-3,32273583,,"When COVID-19 meets centralized, personalized power",Nature Human Behaviour,,"Betacoronavirus; China; Coronavirus; Coronavirus Infections; Decision Making; Humans; Pandemics; Pneumonia, Viral; Politics; Power, Psychological; Stress, Psychological",2020-05,2020,4,5,445-447,All OA; Gold,Article,"Ang, Yuen Yuen","Ang, Yuen Yuen (University of Michigan)","Ang, Yuen Yuen (University of Michigan)",University of Michigan,grid.214458.e,United States,,1,1,,,102,https://www.nature.com/articles/s41562-020-0872-3.pdf,https://app.dimensions.ai/details/publication/pub.1126388658,1606 Political Science; 16 Studies in Human Society,
23,pub.1125023166,10.1016/j.ijid.2020.02.025,32088339,PMC7130104,The basic reproduction number of novel coronavirus (2019-nCoV) estimation based on exponential growth in the early outbreak in China from 2019 to 2020: A reply to Dhungana,International Journal of Infectious Diseases,,"Basic Reproduction Number; Betacoronavirus; China; Coronavirus; Coronavirus Infections; Humans; Pandemics; Pneumonia, Viral",2020-05,2020,94,,148-150,All OA; Gold,Article,"Zhao, Shi; Lin, Qianyin; Ran, Jinjun; Musa, Salihu S; Yang, Guangpu; Wang, Weiming; Lou, Yijun; Gao, Daozhou; Yang, Lin; He, Daihai; Wang, Maggie H","Zhao, Shi (Chinese University of Hong Kong; Chinese University of Hong Kong)","Zhao, Shi (Chinese University of Hong Kong; Chinese University of Hong Kong); Lin, Qianyin (University of Michigan); Ran, Jinjun (University of Hong Kong); Musa, Salihu S (Hong Kong Polytechnic University); Yang, Guangpu (Chinese University of Hong Kong); Wang, Weiming (Huaiyin Normal University); Lou, Yijun (Hong Kong Polytechnic University); Gao, Daozhou (Shanghai Normal University); Yang, Lin (Hong Kong Polytechnic University); He, Daihai (Hong Kong Polytechnic University); Wang, Maggie H (Chinese University of Hong Kong; Chinese University of Hong Kong)",Huaiyin Normal University; Hong Kong Polytechnic University; Shanghai Normal University; Chinese University of Hong Kong; University of Michigan; University of Hong Kong,grid.410738.9; grid.16890.36; grid.412531.0; grid.10784.3a; grid.214458.e; grid.194645.b,China; China; China; China; United States; China,National Natural Science Foundation of China,5,5,,,4,https://doi.org/10.1016/j.ijid.2020.02.025,https://app.dimensions.ai/details/publication/pub.1125023166,11 Medical and Health Sciences; 1117 Public Health and Health Services; 0605 Microbiology; 1108 Medical Microbiology; 06 Biological Sciences,
17,pub.1126637056,10.1111/jgs.16487,32282057,PMC7262114,"Why Am I, as a Geriatric Medicine Fellow with Symptoms, Unable to Get Tested for COVID‐19 While Politicians, Oil Executives, and NBA Players Are?",Journal of the American Geriatrics Society,,"Betacoronavirus; Clinical Laboratory Techniques; Coronavirus Infections; Geriatricians; Geriatrics; Health Resources; Humans; Mass Screening; Pandemics; Pneumonia, Viral; Resource Allocation; Social Class",2020-05,2020,68,5,950-951,All OA; Gold,Article,"Dixon, Joseph",,"Dixon, Joseph (University of Michigan)",University of Michigan,grid.214458.e,United States,,0,0,,,15,https://onlinelibrary.wiley.com/doi/pdfdirect/10.1111/jgs.16487,https://app.dimensions.ai/details/publication/pub.1126637056,11 Medical and Health Sciences,
17,pub.1127694655,10.1016/j.amjsurg.2020.05.024,32446466,PMC7236708,COVID-19: The road to recovery,The American Journal of Surgery,,,2020-05,2020,,,,All OA; Gold,Article,"Diaz, Adrian; Rahmanian, Armin; Pawlik, Timothy M.","Diaz, Adrian (University of Michigan; University of Michigan)","Diaz, Adrian (University of Michigan; University of Michigan); Rahmanian, Armin (); Pawlik, Timothy M. ()",University of Michigan,grid.214458.e,United States,,2,2,,,2,https://doi.org/10.1016/j.amjsurg.2020.05.024,https://app.dimensions.ai/details/publication/pub.1127694655,11 Medical and Health Sciences; 1103 Clinical Sciences,
17,pub.1127263778,10.1097/ju.0000000000001089,32356508,,Delayed Radical Prostatectomy is Not Associated with Adverse Oncological Outcomes: Implications for Men Experiencing Surgical Delay Due to the COVID-19 Pandemic.,The Journal of Urology,,,2020-05,2020,,,101097ju0000000000001089,All OA; Gold,Article,"Ginsburg, Kevin B; Curtis, Gannon L; Timar, Ryan E; George, Arvin K; Cher, Michael L",,"Ginsburg, Kevin B (Wayne State University); Curtis, Gannon L (Wayne State University); Timar, Ryan E (Wayne State University); George, Arvin K (University of Michigan); Cher, Michael L ()",Wayne State University; University of Michigan,grid.254444.7; grid.214458.e,United States; United States,,1,1,,,2,https://www.auajournals.org/doi/pdf/10.1097/JU.0000000000001089,https://app.dimensions.ai/details/publication/pub.1127263778,1117 Public Health and Health Services; 11 Medical and Health Sciences,
15,pub.1126695505,10.1111/jth.14816,32298045,PMC7262366,COVID‐19: 2020 a year in turmoil,Journal of Thrombosis and Haemostasis,,"Betacoronavirus; Coronavirus Infections; Humans; Pandemics; Pneumonia, Viral",2020-05,2020,18,5,993-993,All OA; Gold,Article,"Lillicrap, David; Morrissey, James H.",,"Lillicrap, David (Queen's University); Morrissey, James H. (University of Michigan)",University of Michigan; Queen's University,grid.214458.e; grid.410356.5,United States; Canada,,0,0,,,4,https://onlinelibrary.wiley.com/doi/pdfdirect/10.1111/jth.14816,https://app.dimensions.ai/details/publication/pub.1126695505,1102 Cardiorespiratory Medicine and Haematology; 11 Medical and Health Sciences; 1103 Clinical Sciences,
10,pub.1127988148,10.1016/j.adro.2020.05.009,,PMC7255989,In Regard to Kabarriti et al,Advances in Radiation Oncology,,,2020-05,2020,,,,All OA; Gold,Article,"Chowdhary, Mudit; Greco, Laura; McFarlane, Matt; Spraker, Matthew B.","Chowdhary, Mudit (Rush University Medical Center)","Chowdhary, Mudit (Rush University Medical Center); Greco, Laura (); McFarlane, Matt (University of Michigan); Spraker, Matthew B. (Washington University in St. Louis)",University of Michigan; Washington University in St. Louis; Rush University Medical Center,grid.214458.e; grid.4367.6; grid.240684.c,United States; United States; United States,,0,0,,,,https://doi.org/10.1016/j.adro.2020.05.009,https://app.dimensions.ai/details/publication/pub.1127988148,,
6,pub.1127653015,10.1016/j.gie.2020.05.014,32425235,PMC7229945,Triaging advanced GI endoscopy procedures during the COVID-19 Pandemic: consensus recommendations using the Delphi method,Gastrointestinal Endoscopy,,,2020-05,2020,,,,All OA; Gold,Article,"Sawhney, Mandeep S.; Bilal, Mohammad; Pohl, Heiko; Kushnir, Vladimir; Khashab, Mouen A.; Schulman, Allison R.; Berzin, Tyler M.; Chalal, Prabhleen; Muthusamy, V. Raman; Varadarajulu, Shyam; Banerjee, Subhas; Ginsberg, Gregory G.; Raju, Gottumukkala S.; Feuerstein, Joseph D.","Sawhney, Mandeep S. ","Sawhney, Mandeep S. (); Bilal, Mohammad (); Pohl, Heiko (Dartmouth College); Kushnir, Vladimir (Washington University in St. Louis); Khashab, Mouen A. (Johns Hopkins Hospital); Schulman, Allison R. (University of Michigan); Berzin, Tyler M. (); Chalal, Prabhleen (Cleveland Clinic); Muthusamy, V. Raman (University of California, Los Angeles); Varadarajulu, Shyam (); Banerjee, Subhas (Stanford University); Ginsberg, Gregory G. (University of Pennsylvania); Raju, Gottumukkala S. (The University of Texas MD Anderson Cancer Center); Feuerstein, Joseph D. ()","University of Pennsylvania; Washington University in St. Louis; Cleveland Clinic; Dartmouth College; Johns Hopkins Hospital; The University of Texas MD Anderson Cancer Center; University of California, Los Angeles; University of Michigan; Stanford University",grid.25879.31; grid.4367.6; grid.239578.2; grid.254880.3; grid.411935.b; grid.240145.6; grid.19006.3e; grid.214458.e; grid.168010.e,United States; United States; United States; United States; United States; United States; United States; United States; United States,Boston Scientific (United States); Johnson & Johnson (United States); Medtronic (United States),0,0,,,5,https://doi.org/10.1016/j.gie.2020.05.014,https://app.dimensions.ai/details/publication/pub.1127653015,11 Medical and Health Sciences; 1103 Clinical Sciences,
3,pub.1127978351,10.1016/j.outlook.2020.04.013,32475612,PMC7256611,Maximizing the academic nursing model in the era of COVID-19 and beyond,Nursing Outlook,,,2020-05,2020,,,,All OA; Gold,Article,"Bettencourt, Amanda P.; Vance, Ashlee J.; Jun, Jin; Burns, Jade; Bell, Sue Anne; Costa, Deena Kelly","Bettencourt, Amanda P. (University of Michigan)","Bettencourt, Amanda P. (University of Michigan); Vance, Ashlee J. (University of Michigan); Jun, Jin (University of Michigan); Burns, Jade (University of Michigan); Bell, Sue Anne (University of Michigan); Costa, Deena Kelly (University of Michigan; University of Michigan)",University of Michigan,grid.214458.e,United States,Agency for Healthcare Research and Quality; National Institute on Aging; National Heart Lung and Blood Institute; Alexander Graham Bell Association for the Deaf and Hard of Hearing,0,0,,,17,https://doi.org/10.1016/j.outlook.2020.04.013,https://app.dimensions.ai/details/publication/pub.1127978351,1110 Nursing; 11 Medical and Health Sciences,
